id,post_id,author,date,upvotes,content
108zqmx,j3vcby8,_whitezetsu,2023-01-11 08:43:32,38,"I mean there are tons and tons of resources out there plus Alexey's DE zoom camp (Datatalksclub) which costs 0 dollars and has a very good reputation in community, why not begin with them? Plus I genuinely believe if you are decent enough you probably don't need a bootcamp to land you a job."
108zqmx,j3vmcut,yellowmamba_97,2023-01-11 11:03:43,9,"Damn, these tuition fees are almost equivalent to the MSc computer science degrees of UT Austin and Georgia Tech. Bootcamps are in my opinion not worth it if you pay such a heavy amount. You could basically replicate their curriculum with free or courses with a lower fee of the applicable vendors, such as Google or Amazon."
108zqmx,j3w0frz,j__neo,2023-01-11 13:28:18,6,"Hello there, I'd suggest checking out [Data Engineer Camp](https://dataengineercamp.com/) if you haven't already. Our next cohort is kicking off July/August 2023. Student testimonial [here](https://app.vouchfor.com/116QBDHIvO)."
108zqmx,j3xxnwy,chrisgarzon19,2023-01-11 20:49:59,2,"My problem with bootcamps is that’s not actually focused on getting you a job. I mean, 800 hours in 20 weeks?

You have 40 hours a week available?

That’s the difference between bootcamps and mentors btw 

A bootcamp focuses on teaching every nuance possible that you may never use again (like school)

Vs. a mentor who’s job is to accelerate your path


P.S I’m a proponent for free over bootcamps like these that are TOO structured"
108zqmx,j3x1h9b,tentative_guy22,2023-01-11 17:33:55,2,OP i hope you don’t feel discouraged by the feedback. They mean well. Thanks for sharing your effort.
108zqmx,j3ygpcg,None,2023-01-11 22:47:51,1,"if a bootcamp isnt free, its a scam. tech is unbelievably toxic with this crap."
108zqmx,j3z5ss5,Altruistic-Choice-37,2023-01-12 01:38:06,1,it's overpriced
108zqmx,j3vx7o4,jppbkm,2023-01-11 13:00:21,0,These both look like much worse content (and value) than what's available for free or cheap online.
108zqmx,j3vcgsm,_whitezetsu,2023-01-11 08:45:24,16,Apologies if this sounds rude but this is a ridiculous amount to pay for something you can learn for absolutely free.
108zqmx,j3vshvp,ThisMud5529,2023-01-11 12:15:04,4,"Yeah I totally agree. There loads of free materials and resources online. You might only need to spend some on cloud deployments if you've never used their free trials. 

I know some people prefer to go to these kind of bootcamps to have a structured and curated learning experience. Personally, for that price why not wait a month and try out courses on other platforms (ie. udemy/codecademy/coursera etc) Some even offer 30-day money back guarantee. And surely give DataTalks a try. It's free and starting on Jan 16 I think."
108zqmx,j3wcdqv,Proof_Elk_2281,2023-01-11 14:56:44,4,"I will second this and say you should do the DE zoomcamp. I did it with just basic coding experience (mostly R for some stats related to grad research) and had lots of interest in my resume when I was a fresh grad.

The best part is that you can focus on the parts that interest you the most. If you're really interested in analytics engineering you can go deep into a project with an ELT stack, if you want to focus on big data ETL you can do something with Spark, etc.. I did dbt and Airflow because I just picked something I time for while also finishing my degree. This time around I'm following along again and am going to do something with Kafka, just to learn the tech because I think it's interesting.

The only thing Alexey doesn't really cover that I think a paid bootcamp would is interview prep including DSA. But resources like neetcode have made things like DSA a lot more accessible to learn for free imo."
108zqmx,j3wbc8j,raz_the_kid0901,2023-01-11 14:49:42,1,I am going to give that datatalks a try. I need structure in my life.
108zqmx,j3yyc56,jun_dagster,2023-01-12 00:45:59,1,Appreciate letting me know about the Zoom camp!
108zqmx,j3wwdgw,mrchowmein,2023-01-11 17:03:27,2,"Yep, if one wants to pay university rates, might as well get that cs degree as that will go further than any BootCamp."
108zqmx,j6hc7e2,BrackishClarity,2023-01-30 09:20:57,2,Are there any mentorship type programs out there?
108zqmx,j3whkao,tigerkingsam,2023-01-11 15:30:58,6,What you’re saying is true but some people can’t self study and need some structure in place for them to focus like college. But yeah Datatalks club makes a lot of sense
108zqmx,j497pfp,None,2023-01-14 01:10:16,1,I actually want to eventually go for masters. But I need my professional to be strong enough to be able to get into a decent programme. The UT Austin programme looks to be decent and it's affordable. I just need to strengthen my profile
108zqmx,j6hmrcd,chrisgarzon19,2023-01-30 11:46:17,1,"[I have my own, so I’m biased!](https://dataengineerinterview.com/products/)"
108zqmx,j4978ly,None,2023-01-14 01:06:42,1,"Yeah that's where I am as well. Additionally, the camp I'm looking at will help give me a solid python base which I think I lack. After I'm done I'm going to go through the DTC stuff. DE, MLE, and MLOps. The way it was set up looks good. I just don't think I have the base to get what I need from it. It's a much more difficult ramp up without the background and one can get lost. The structure helps one realise it's just part of the journey"
10v7ult,j7fu1r1,AutoModerator,2023-02-06 14:24:42,1,"
Dear /u/lengthy_preamble!

Hello and thanks for posting! Please read the [sub’s etiquette page](https://www.reddit.com/r/resumes/wiki/index/howtoparticipate) to learn about proper etiquette and remember to: 

1. Censor your personal information for your own safety,
2. Add the right flair to your post, 
3. Tell us why you're applying (i.e., just looking to fine-tune, not getting any interviews etc.), and 
3. Indicate the types of roles and industries you’re interested in. 

Don't forget to check out the [wiki](https://www.reddit.com/r/resumes/wiki/index) as well as the quick links below for tips: 

* [Resume Writing Guide](https://www.reddit.com/r/resumes/wiki/index/faq)

* [If you're applying online, use a single-column format](https://www.reddit.com/r/resumes/comments/s2b37q/if_youre_applying_online_use_a_single_column/)

* [Biggest mistakes that affect your resume's performance and how to fix them](https://www.reddit.com/r/resumes/comments/tq061t/biggest_mistakes_that_impact_your_resumes/)

* [What is an applicant tracking system?](https://www.reddit.com/r/FinalDraftResumes/comments/wodrrs/what_is_an_applicant_tracking_system/)

* [Free Resume Template - Google Docs](https://docs.google.com/document/d/1wdkgpgU7lFoV801ysrBn8qrPaIpyUsUH/edit?usp=sharing&ouid=103022094325852815590&rtpof=true&sd=true)

* [Thinking of hiring a resume writer? Read this first](https://www.reddit.com/r/resumes/comments/x3eg1e/considering_hiring_a_resume_writer_read_this_first/)


*I am a bot, and this action was performed automatically. Please [contact the moderators of this subreddit](/message/compose/?to=/r/resumes) if you have any questions or concerns.*"
10v7ult,j7fzfl4,St_Melangell,2023-02-06 15:04:41,2,"It has its good points but in my opinion, it’s far too wordy. Distil each job down to 4-5 of your top achievements, backing them up with numbers & data if applicable (such as simplifying a process, saving 80% of admin time). Also for the two studentships, I’d put them in a separate section, maybe Internships or similar."
10v7ult,j7g5gpp,gthirteen_13,2023-02-06 15:46:52,2,"First of all 2 pages? No way sir.

Why the graphic? Why isn't your name centered?  Why are the headers centered?  Why are there colors?  Shadows over the headers? you might think this looks fancy but it really just looks like it's formatted incorrectly.

get rid of ""data engineer"", the objective statement, and signature competencies.  Then take your education & affiliations/technical proficiencies combine them and call it skills and put that first thing after your name/info/etc...

Then you need to concentrate on shortening all the work experience down to the most important things, and be precise and use data.  Possibly changing the format to summarizing the exp (instead of bullets) and then bullet listing 3 accomplishments per job would be the way.  You might also think to omit the aws cloud admin, and ""student"" exp, and add an education section.

You have a lot of work to do before this is presentable to anyone that reads resumes.  I tossed it right away because it overwhelmed me with length PLUS it had an objective summary.  

You have a lot of great things but we don't need to know every single task you did, summarize.    


ONE PAGE!!!!!!!!!!!!!"
10v7ult,j7fzkwx,lengthy_preamble,2023-02-06 15:05:46,2,"I concur, thank you!"
10v7ult,j7g6wrj,lengthy_preamble,2023-02-06 15:56:38,1,"Ok thanks. Any tips on how I can ""datafy"" my accomplishments? i.e., ""My automation of widget production saved 98% of operational budget etc etc"". I don't have a lot of this data on hand, is it a given that some fudge work is involved? Or is it acceptable to say something like ""Automated a process that previously was 95% manual work""?"
10v7ult,j7g9dg3,gthirteen_13,2023-02-06 16:13:17,1,They won’t fact check your data
10v7ult,j7ga19l,lengthy_preamble,2023-02-06 16:17:42,1,"Good point, thanks. I was also just wondering if it's equally acceptable to put ""challenge met"" types of accomplishments even if they don't have hard numbers. Perhaps something like:

""Addressed the lack of automation in data vetting process by creating python scripts that check the data and create reports based on existing criteria"", something like that."
10v7ult,j7gah8p,gthirteen_13,2023-02-06 16:20:41,2,"Achieved the goal of addressing the absence of automation in data vetting by developing Python scripts that verify the data and generate reports according to established standards.

Successfully remedied the inefficiency in the data vetting process by writing Python scripts that validate the data and produce reports using pre-defined criteria.

Resolved the issue of manual data vetting by creating Python scripts that assess the data and compile reports according to established criteria."
10v7ult,j7gao94,lengthy_preamble,2023-02-06 16:21:58,1,"Very nice, many thanks"
10v7ult,j7gb5pj,gthirteen_13,2023-02-06 16:25:09,1,"You can elaborate on those but it will be too many words at that point.  Although using numbers and data will make it stand out even more.

an example

Achieved the goal of improving the data vetting process by creating Python scripts that validate the data and produce reports according to established criteria, resulting in a 50% reduction in the time required to generate these reports."
10v7ult,j7gblgo,lengthy_preamble,2023-02-06 16:28:05,1,"This has the fringe benefit of making it easier to know what to trim from my resume. If the benefit of an accomplishment is too nebulous to quantify, then it's probably best to snip it out."
10v7ult,j7gc1um,gthirteen_13,2023-02-06 16:31:06,1,"List a basic description of what your experience is and then throw 3 awesome accomplishments at them.  It's not what you do on a daily, it's what you did that is extraordinary and over the top, and that's what's important.  Collaborating is showing teamwork which is great, but saving the company time and money is better."
10v7ult,j7gcs0v,lengthy_preamble,2023-02-06 16:35:53,1,"Is there a good way to put that I did something on my own initiative, rather than being told to do it?"
zn1vhc,j0edrcg,AutoModerator,2022-12-16 00:57:43,1,"You can find a list of community-submitted learning resources here: https://dataengineering.wiki/Learning+Resources

*I am a bot, and this action was performed automatically. Please [contact the moderators of this subreddit](/message/compose/?to=/r/dataengineering) if you have any questions or concerns.*"
zn1vhc,j0fravc,Bad-Rich,2022-12-16 08:48:06,3,"Check out Data Engineering Zoomcamp. It’s free and next cohort starts January 16, 2023

More info here: https://github.com/DataTalksClub/data-engineering-zoomcamp

DEZ 2022: https://youtube.com/playlist?list=PL3MmuxUbc_hJed7dXYoJw8DoCuVHhGEQb"
zn1vhc,j0ei2di,blacksnowboader,2022-12-16 01:31:17,2,"So here’s my general advice on this, choose whatever will help you learn data engineering depending on your schedule and learning style. I cannot answer that for you. 

That being said, the way to get better at ANYTHING related to coding is by practicing.  Pick a project that you care about, or start doing the data pipelines yourself at your job instead of handing them to DE’s. And that’s how you will get better at Data Engineering. And if that’s an issue with your job, it’s sometimes better to ask for forgiveness than permission."
zn1vhc,j0ehzxm,HeavyFuckingMetalx,2022-12-16 01:30:46,1,Cost of each program? I feel like this is an important metric to leave out.
zn1vhc,j0f1ezh,WeirdWorldDz,2022-12-16 04:01:09,1,"I feel you 1000%, I face the same issue."
zn1vhc,j0ehx6c,Wealth-Severe,2022-12-16 01:30:11,0,RemindMe! 3 days
zn1vhc,j0h73xo,StrikeSaber47,2022-12-16 16:48:56,1,"Thanks for this! I have heard about this one too. Compared to the paid ones, is this one been solid for what it is?"
zn1vhc,j0ennxs,StrikeSaber47,2022-12-16 02:13:39,1,"I don't know if the teams that controls access to the production environments will let me get my own hands deep into it. However, I have been pushing for some of those processes to be handed over to our team and I will spearhead working on them...

As for projects, I feel like I definitely could self-serve and go that route, but I am not sure how impactful they could be considering the examples you use are most just toy or old data in general, but you are right, you are still learning!"
zn1vhc,j0en9iq,StrikeSaber47,2022-12-16 02:10:31,1,"Oops yep here's the financial breakdown:

1. Jigsaw Labs - $9500 USD - 24 Weeks
2. DEC - ~$3000 USD (Converted from AUD) -14 Weeks
3. WeCloudData - ~$7300 USD (Converted from CAD) - 24 Weeks"
zn1vhc,j0ehzok,RemindMeBot,2022-12-16 01:30:43,1,"I will be messaging you in 3 days on [**2022-12-19 01:30:11 UTC**](http://www.wolframalpha.com/input/?i=2022-12-19%2001:30:11%20UTC%20To%20Local%20Time) to remind you of [**this link**](https://www.reddit.com/r/dataengineering/comments/zn1vhc/best_de_bootcamp_based_on_my_experience_and/j0ehx6c/?context=3)

[**CLICK THIS LINK**](https://www.reddit.com/message/compose/?to=RemindMeBot&subject=Reminder&message=%5Bhttps%3A%2F%2Fwww.reddit.com%2Fr%2Fdataengineering%2Fcomments%2Fzn1vhc%2Fbest_de_bootcamp_based_on_my_experience_and%2Fj0ehx6c%2F%5D%0A%0ARemindMe%21%202022-12-19%2001%3A30%3A11%20UTC) to send a PM to also be reminded and to reduce spam.

^(Parent commenter can ) [^(delete this message to hide from others.)](https://www.reddit.com/message/compose/?to=RemindMeBot&subject=Delete%20Comment&message=Delete%21%20zn1vhc)

*****

|[^(Info)](https://www.reddit.com/r/RemindMeBot/comments/e1bko7/remindmebot_info_v21/)|[^(Custom)](https://www.reddit.com/message/compose/?to=RemindMeBot&subject=Reminder&message=%5BLink%20or%20message%20inside%20square%20brackets%5D%0A%0ARemindMe%21%20Time%20period%20here)|[^(Your Reminders)](https://www.reddit.com/message/compose/?to=RemindMeBot&subject=List%20Of%20Reminders&message=MyReminders%21)|[^(Feedback)](https://www.reddit.com/message/compose/?to=Watchful1&subject=RemindMeBot%20Feedback)|
|-|-|-|-|"
zn1vhc,j0hl3es,Bad-Rich,2022-12-16 18:19:12,1,"I can’t really compare coz I have not taken any of the paid ones.. Though I have started watching the 2022 recordings and have enjoyed it. My plan is to finish 2022 in prep of the 2023 cohort ( I am new to DE too), of which all of that is in prep for DataEngineerCamp, which I’m still mulling over."
zn1vhc,j0eohjx,blacksnowboader,2022-12-16 02:19:57,1,"So on one hand, you’re going to be paying to use toy datasets…. Or you could bring doing toy datasets yourself. Or you could ask the data engineers if you could work on it yourself so you can learn it. 

I’m not sure if this is a trend in the Data Engineering world as it is the in the Data Science world. But I know in Data Science, the trend is… the certificate from a boot camp is not worth the paper if is printed on."
zn1vhc,j0eq3g5,HeavyFuckingMetalx,2022-12-16 02:32:16,3,"I feel like you could buy Udemy courses on such topics (MongoDB, Spark, Airflow, etc.) for a lot cheaper. That’s the route I’m going. I’ll piece everything together for a final project."
zn1vhc,j0epu1m,StrikeSaber47,2022-12-16 02:30:17,1,Got any free learning resources to help build my own self-learning plan for this project? I could try to see over the holidays to attempt something before I consider if a bootcamp is worth pursuing. I tend to learn best with some structure (syllabus).
zn1vhc,j0er9fn,StrikeSaber47,2022-12-16 02:41:05,1,"Could you provide me a rough 'syllabus' on the Udemy courses you are taking to self-learn? It would give me a rough idea on how and what I need to do. Udemy is having a massive sale too so, this could be a good time to hop on buying up courses too. Thx!"
zn1vhc,j0epznb,blacksnowboader,2022-12-16 02:31:28,2,"Read the wiki dude, that’s why it’s there."
zn1vhc,j0f444i,HeavyFuckingMetalx,2022-12-16 04:24:06,2,"* [MongoDB](https://www.udemy.com/course/mongodb-the-complete-developers-guide/)
* [Airflow](https://udemy.com/course/the-ultimate-hands-on-course-to-master-apache-airflow)
* [PySpark](https://www.udemy.com/course/spark-and-python-for-big-data-with-pyspark/)
* [Snowflake](https://www.udemy.com/course/snowflake-masterclass)
* [MySQL](https://www.udemy.com/course/the-ultimate-mysql-bootcamp-go-from-sql-beginner-to-expert)"
zn1vhc,j0eysdk,droe771,2022-12-16 03:39:45,1,You can just click on the course and see the syllabus.
zn1vhc,j0erwe2,StrikeSaber47,2022-12-16 02:46:02,1,"I did, but there is a lot of different courses, not sure which ones are optimal. However, I will explore the options."
114x6lq,j8yck55,AutoModerator,2023-02-17 20:48:09,1,"
Dear /u/lengthy_preamble!

Hello and thanks for posting! Please read the [sub’s etiquette page](https://www.reddit.com/r/resumes/wiki/index/howtoparticipate) to learn about proper etiquette and remember to: 

1. Censor your personal information for your own safety,
2. Add the right flair to your post, 
3. Tell us why you're applying (i.e., just looking to fine-tune, not getting any interviews etc.), and 
3. Indicate the types of roles and industries you’re interested in. 

Don't forget to check out the [wiki](https://www.reddit.com/r/resumes/wiki/index) as well as the quick links below for tips: 

* [Resume Writing Guide](https://www.reddit.com/r/resumes/wiki/index/faq)

* [If you're applying online, use a single-column format](https://www.reddit.com/r/resumes/comments/s2b37q/if_youre_applying_online_use_a_single_column/)

* [Biggest mistakes that affect your resume's performance and how to fix them](https://www.reddit.com/r/resumes/comments/tq061t/biggest_mistakes_that_impact_your_resumes/)

* [What is an applicant tracking system?](https://www.reddit.com/r/FinalDraftResumes/comments/wodrrs/what_is_an_applicant_tracking_system/)

* [Free Resume Template - Google Docs](https://docs.google.com/document/d/1wdkgpgU7lFoV801ysrBn8qrPaIpyUsUH/edit?usp=sharing&ouid=103022094325852815590&rtpof=true&sd=true)

* [Thinking of hiring a resume writer? Read this first](https://www.reddit.com/r/resumes/comments/x3eg1e/considering_hiring_a_resume_writer_read_this_first/)


*I am a bot, and this action was performed automatically. Please [contact the moderators of this subreddit](/message/compose/?to=/r/resumes) if you have any questions or concerns.*"
114x6lq,j8ym06j,cyberw0lf_,2023-02-17 21:50:57,1,"I’d put your professional experience first and organize your technical proficiencies instead of just having a list of tools and technologies that you worked with. 

Additionally, and this is just an assumption from what I see in front of me, I believe some automated HR screening systems would filter out your resume because of the formatting. You have unnecessary lines, grey boxes, and unique bullet points. For all I know none of these are issues but I have seen HR screen systems filter for less. I’d recommend making your resume look as bland as possible."
114x6lq,j8ymt1n,lengthy_preamble,2023-02-17 21:56:18,1,"Thank you, I'll take a look into that!"
xiodrj,ip42ayj,AutoModerator,2022-09-19 20:53:41,1,"You can find a list of community submitted learning resources here: https://dataengineering.wiki/Learning+Resources

*I am a bot, and this action was performed automatically. Please [contact the moderators of this subreddit](/message/compose/?to=/r/dataengineering) if you have any questions or concerns.*"
xiodrj,ip68jz3,MikeDoesEverything,2022-09-20 09:14:31,3,"Might be me being cynical and, full disclosure, I've not done a proper bootcamp before, however, surely the content is secondary? All that matters is you get placed because whatever you learn in the course will get superseded by whatever you learn on the job.  So, I'd look into what their post course placement numbers are like and speak to graduates of the bootcamps about how they handle the placement."
xiodrj,ip7uv2v,543254447,2022-09-20 17:12:50,3,"Hey klailatimad,

I attended one of these bootcamp and can provide you more info if you DM me.

Long story short, it is not necessary if you have the drive and a clear goal. I truly believe you can learn everything online if you want.

However if you are like me and needs that extra push and more hand holding, bootcamp can help to some degree. In the end it is up to you to make it in this field. Don't expect to come out with a job if you are not putting in the work.

In my case, it was not a bad idea, I have some SQL and ETL experience before and want to make it to the next level. Also money was not that much of an issue to me since I also did some time in the OG sector.

I just needed the structured and guided learning towards DE."
xiodrj,ip6obtu,Lower_Sun_7354,2022-09-20 12:19:48,2,"Nope, nope, nope, and nope.  All too expensive, udacity is the only exception, but not great quality.

You want hands on experience.  Instead of $5-15K, spend $1000 on testing out the cloud for yourself.  

I was looking at a $4K Microsoft BI program a few years back.  It was going to take 9 months to complete.  Made a deal with myself that I could complete Microsoft Certs on my own, for less, in a shorter amount of time.  Posted those on LinkedIn and the recruiters found me.  Did the same with Azure and AWS.  

These certs usually cost $100, exam prep is about $150, plus a bunch of youtube and Udemy (about $15/course)."
xiodrj,ip7uvsu,klailatimad,2022-09-20 17:12:57,1,"Thank you for your input and reply.

Will see how I can reach out to recent graduates and how many of them had placements because of the bootcamp, or if it was due to their projects and them being hired directly by headhunters or companies."
xiodrj,ip7v75p,klailatimad,2022-09-20 17:14:56,1,"Thanks for your reply.

I'm glad you took a different route while committing time to self development which led to you being noticed by the recruiters.

That's another route that I can look into to see what's available online in terms of certs that would help me reach my goal, while spending less money than at the bootcamps."
xiodrj,ip7zvyw,Lower_Sun_7354,2022-09-20 17:44:18,1,"If you really like the structure of these programs, and to each their own, I'd go with MIT because of the name recognition. And it seems to be a lower, albeit still expensive, option compared to some of the others you've listed."
xiodrj,ip8gr65,klailatimad,2022-09-20 19:33:04,1,"Of course. To each his own for sure.

Thanks for the recommendation."
w6x605,ixrbd4n,Jeromes-in-the-House,2022-11-25 18:38:13,1,What did you end up picking?
w6x605,ixz8a3v,Snxwe,2022-11-27 15:31:38,1,None of them :) Sitting in an office isn't for me.
u76io5,i5cmu69,vasaforever,2022-04-19 15:01:40,2,"Some bootcamps can vary in quality so dig into their posted results and try to talk to other grads. If you can find a bootcamp from a public university like University of Michigan, MIT, Ohio State, that's a little better as you're getting the university's name and brand weight behind it, along with some access to teachers/teaching assistants that teach undergrad courses. 
You can also look at online industry job programs like Udacity, who have a pretty good Data program which also includes LinkedIn development, resume review, and job socials with top employers in your area or online depending on how the program is done.

Alex explains the path relatively well and also mentions the IBM Data Analyst Professional Certificate from Coursera: https://youtu.be/yDG5KiiOZcQ

Luke goes into the technical and programming approach to how to learn Data in 2022 which I think is very well organized. https://youtu.be/CC66RXeTn_4

Tina also has a great discussion on how to maximize your learning in this space: https://youtu.be/Axu4tJl8gbM

In general, the job postings you see call for SQL, Python/R, some sort of BI tool so PowerBI or Tableau, and you're seeing cloud more."
u76io5,i5cj58k,None,2022-04-19 14:37:34,1,I'd start by asking your employer if there are any help desk positions available within the company in your area. See if they will pay for industry standard certifications even if there aren't any entry level tech positions. The most common cert is A+ the rest are much more specialized.
u76io5,i5cpya4,zubzup,2022-04-19 15:21:50,1,"Thank you. Am I able to skip data analytics and dive straigjr into Data Engineering, DEVops or data science. Reason is data analytics is entry level and less paid."
u76io5,i5cpmrv,zubzup,2022-04-19 15:19:50,2,Thing is I am already at a pay level and have financial obligations. I am also 31. Cannot go to a help desk job at this point in life..
