id,post_id,author,date,upvotes,content
u76io5,i5cr31t,vasaforever,2022-04-19 15:28:50,2,"DevOps is a completely different skill set than Data Engineering and using a different skill set and knowledge base.

Yes you can start learning Data Engineering now as it'll cover most of the same stuff you'd learn as an analyst except the BI tools. You'll need to have a good understanding of data storage, databases, APIs etc, cloud, etc. It's a lot more involved due to the number of tools and language.

It's more of a question of if you're able to get a Data Engineering role off the street without previous tech experience. If you have a finance or math degree, or requisite certifications and solid portfolio it's possible. It may be worth looking in your company to see if there are internal roles to increase your chances as well."
u76io5,i5cqnve,CWykes,2022-04-19 15:26:06,3,"Even if you have certifications and boot camps completed I’m pretty sure you’ll need to start in a support role like help desk anyways. The only thing that would allow you to start above support, besides connections or luck, is related experience. It’s an unfortunate pay cut many people have to take to start a career in this field, but if you like IT then it’s worth it"
u76io5,i5cq59u,OrangeyougladIposted,2022-04-19 15:23:00,1,"Help desk is a loaded term.   Helpdesks can go all the way to 70k

&#x200B;

To give other advice,   Python is a decent starting point and diving into data reporting platforms like PowerBI, tableau or crystal reports is a good way to get a foot in the door"
u76io5,i5cqk9t,None,2022-04-19 15:25:30,1,Maybe stay at your job and even try going back to school. To safely make a lateral move across two different careers with no experience or technical training will be challenging but not impossible.
u76io5,i5dxpaj,zubzup,2022-04-19 19:55:01,2,"Great thanks!  


If you were to choose between:  


Data Engineering  
DEV OPS  
Dats Science  


Which would do you recommend?"
u76io5,i5dxgjc,zubzup,2022-04-19 19:53:30,2,I see your point.
u76io5,i5dzie9,vasaforever,2022-04-19 20:06:06,2,"You're welcome.

Your question borders on being binary and can't be answered by anyone but you. It's about you, your current education, goals, timeline, and what aspects of IT or CS that you enjoy. Since you're switching careers there is a different decision tree and requirements that can influence your decision.

To pull a quote from Stanislaw Lem ""there are no answers, only choices."""
u76io5,i5dz5st,CWykes,2022-04-19 20:03:57,1,"Good luck, I hope you find a solution that you like and fits your financial needs!"
u76io5,i5e0ca9,zubzup,2022-04-19 20:11:18,1,Hah
u76hcp,i5d0y5z,Deep-Temperature,2022-04-19 16:31:49,1,What bootcamps are you considering. Bootcamps should be a good starting point. You have to put your efforts though
u76hcp,i5dxwsc,zubzup,2022-04-19 19:56:19,1,"I agree.  


I am considering weclouddata and light house labs. Both are bassed in Toronto but are pricey ($10k)  


I could also go for MIT Data science course which is cheaper but I feel it will be more corporate."
u76hcp,i5erknk,Deep-Temperature,2022-04-19 23:11:38,1,"Before going for pricey bootcamps, consider going for free online material. Data science sounds nice but in reality the work you will get at entry level will be an analyst and if you are lucky some data science. Please tread with caution. There are other technologies/ skillsets that are easier to get into and pay will be good. It's better to go for full stack developement, DevOps, RPA,AWS etc."
wo8xhf,ik9j3b0,NickSinghTechCareers,2022-08-14 15:41:44,5,"Wrote a whole book about it fam! It’s like Cracking the Coding Interview.. but for Data Science! 

[Ace the Data Science Interview](https://www.acethedatascienceinterview.com)

Also put together a free SQL interview platform: [DataLemur](https://datalemur.com)"
wo8xhf,ikaoe5l,makonde,2022-08-14 20:24:32,1,Check out WeCloudData on youtube and on meetup.com they are a bootcamp in TO but also do a lot of very informative videos and meetups.
su93up,hx8is8s,AutoModerator,2022-02-16 23:03:07,1,"You can find a list of community submitted learning resources here: https://dataengineering.wiki/Learning+Resources

*I am a bot, and this action was performed automatically. Please [contact the moderators of this subreddit](/message/compose/?to=/r/dataengineering) if you have any questions or concerns.*"
su93up,hx8mfso,rjog74,2022-02-16 23:28:47,2,I do not know about wecloud but I can assure you that univ.ai is a great place to Learn
su93up,hxa2kch,dev_anon,2022-02-17 06:53:05,2,Do Andrea’s data engineering course. Good content from the look of it. I did data engineering nano degree from udacity which was great but Andrea’s one seems more comprehensive.
su93up,hxbe30e,Stuck_in_Arizona,2022-02-17 15:14:08,1,">Andrea’s data engineering course

I'm assuming it's this? [https://learndataengineering.com/p/academy](https://learndataengineering.com/p/academy)

Been doing some lurking and want to move up from support, but unsure if I want to pursue cloud any further.  Looking for career QOL and not break/fix 1AM-6AM and work a full day after kind of thing."
su93up,hxd0v13,dev_anon,2022-02-17 21:23:58,1,Yea that is the one. Cloud is the future for data work. You can pick the 9-5 de roles not support roles.
rm8uos,hpkm393,AutoModerator,2021-12-22 16:30:23,1,"You can find a list of community submitted learning resources here: https://dataengineering.wiki/Learning+Resources

*I am a bot, and this action was performed automatically. Please [contact the moderators of this subreddit](/message/compose/?to=/r/dataengineering) if you have any questions or concerns.*"
rm8uos,hpkw766,BoneThrone92,2021-12-22 17:38:33,15,I would heavily recommend against this. The best way to pivot to data engineering is to start hopping to more technical roles. Trying getting a job as a data analyst and start using python. After a few years you'll be ready to make the jump. Hiring managers will prefer a BI dev or data analyst with work experience over a bootcamp.
rm8uos,hplksq4,mrchowmein,2021-12-22 20:24:08,6,"If you're an analyst already, try to find a position such as data analyst that works closely with DE/DS teams so you can learn the technical side. The bootcamps are not that useful beyond just giving you some background info about DE. It's a good way to polish your skillset, but that's about it in my opinion. People here ask about bootcamps every once in awhile. Between my friends and I who are also DEs at multiple companies, no one is getting hired based on DE bootcamps.  You kinda need to fall under 3 categories: an advanced degree that is CS or data related (such as chemistry where you have to write programs to perform analysis on a cluster), seasoned software engineer, or a data analyst. There are not many jr positions available in general as the upskilling required is relatively high compared to other types of software engineering roles. So the route for the non-engineer who doesnt want to go back to school is usually the data analyst route."
rm8uos,hplgld2,nudgekennels,2021-12-22 19:55:40,2,"Thanks, that makes sense. A follow up question — so WeCloudData offers the students an opportunity to work on “real client project” that they take on from various companies. I think that if I tried to get a job, I would be working, as you said, as an analyst. A part of me thinks that it would be better to be able to put a line on my resume that’s actually data engineering work, even if it’s pro bono through a bootcamp. What do you think?"
rm8uos,hplmlaz,nudgekennels,2021-12-22 20:36:13,1,"Thanks, that makes sense. So I mentioned this in my reply to another post, but one of the bootcamps offers the students an opportunity to work on “real client project” that they take on from various companies. I think that would be actual data engineering work I can put on my resume, even if it was pro bono work. Do you think there’s value in that? Or do you think that being an analyst and working closely with DE/DS team is better?"
rm8uos,hpmekfg,pacific_plywood,2021-12-22 23:55:40,1,"If you are already doing programmatic work, then - given some self-studying on the side - you could just get these roles without paying for a bootcamp"
rm8uos,hpm20c1,mrchowmein,2021-12-22 22:22:06,2,"I dunno what real client project means. How long is the bootcamp. If you can see a sample client project and is complex enough maybe it’s worth it. If I was in your shoes, I would go the analyst route and do a course or bootcamp while you’re analyst on the side."
rm8uos,hpm3m0o,nudgekennels,2021-12-22 22:33:39,1,"It’s fairly long. 25 weeks. Lectures Wednesday nights and Saturday all day. We’re supposed to work on the client projects during the week starting about 4-7 weeks in. I’m not currently working as an analyst, I just have about 5 years experience from a while ago. So I could either be applying for analyst jobs and doing the bootcamp part-time (which doesn’t come with the client project), or I could just do the bootcamp fulltime (which comes with the client project). I’ve asked about sample client project, but they said that because it’s for an actual client they can’t share it with me. It’s done with the guidance of one of the instructors. I feel like I might as well do the full-time, since it might take a bit of time to find an analyst job anyway? I’m not sure. Really appreciate the input by the way."
rm8uos,hpnxqeo,sumrandom3377,2021-12-23 09:20:00,1,How much does it cost?
vh20md,id56flx,sumonigupta,2022-06-21 03:59:01,3,You have to also attach the link to the program so that we can understand the depth and coverage of the topics.
vh20md,id57my7,shining_shrek,2022-06-21 04:11:17,2,"I would say adding on to your skillset is never a bad idea. When we look holistically, all the fields involving data are evolving. Considering your background, it is definitely a good idea to add on to your existing skills. There are many introductory courses available for free on youtube if you wanna get a good introduction into the field of data engineering. But an instructor guided course is always better. I would advise taking the course beforehand is definitely a good idea rather than taking it while you work on the same stuff(Might be a little overwhelming to do work and learn if you have the option of doing it beforehand)"
vh20md,id864s8,GypsyElder,2022-06-21 21:05:59,1,"[WeCloudData](https://weclouddata.com/wp-content/uploads/2022/06/Data-Engineering-Bootcamp.pdf)

If you scroll to the bottom, the full curriculum is there. I plan to do part-time which is Wednesday evenings and Saturdays."
qawanj,hh6ck01,Wellwisher0,2021-10-19 00:37:44,2,I would start with a college program. Boootcamps for data analyst roles are a waste of money.
qawanj,hh7wbk1,That_anonymous_guy18,2021-10-19 11:06:37,2,University of Toronto offers a 2 year program. That might be a better fit.
qawanj,hr2zp9o,m123av,2022-01-03 15:37:59,1,Is it a waste of money because the information is too much or too little to get a job?
qaw2to,hh5mnzy,JabroniVille69,2021-10-18 21:14:47,2,This is the way
qaw2to,hh5s1jk,larry_is_not_my_name,2021-10-18 21:55:00,1,"Try to find the most reputable bootcamp or course you can that's as close to what you're looking for as possible.  A lot of your learning will come post bootcamp, either through your own initiative or on the job.

A bootcamp grad myself from a few years back, mostly it was a great way to get introduced to others in code and build a network while learning a few things.  That is, while a lot of the learning was ok (some of it was good and some of it was not), the real benefit was being in that space mentally and meeting others who want to do the same thing.

Since graduating and through work, I've built a lot of other projects using different tech stacks.  This is where most of my actual learning has taken place.

TL;DR Think of a bootcamp as a great place to start your learning rather than as a place to master anything.  More importantly, most people find that the network they make at a bootcamp to be more valuable than the learning, so do what you can to make solid connections."
qawkkc,hhxc40h,SeaBoth,2021-10-24 23:51:30,2,I’m from Toronto too. I would try connecting with people on linked in! I applied to a couple masters programs for CS that dont require an undergrad degree. Probably going to do one of thise
qawkkc,i5cqkiy,zubzup,2022-04-19 15:25:32,1,Which programs are these? Can you please share :)
qawkkc,i5cqm2s,zubzup,2022-04-19 15:25:48,1,Which programs are these? Can you please share :)
qawkkc,i5cqn1l,zubzup,2022-04-19 15:25:57,1,Which programs are these? Can you please share :)
qhetd1,hid6bwv,rudboi12,2021-10-28 10:51:54,4,I don’t think there is any specialized bootcamp for DE. Follow awesome data engineering path and get databricks spark certifications.
qhetd1,hies5ou,543254447,2021-10-28 18:07:55,2,"Hey Dependent-Report-434,

I am currently looking into this one as well and I also have an Engineering degree. So far, I found 2 of them after a few days of research. 

* pipeline date engineering academy (Berlin, Germany)
* WeCloudData (Toronto, Canada)

These are not cheap, they are both around 10k USD. I am in no way affiliated with them but I am currently looking into the bootcamp as well. Not sure about the quality since I haven't attended them yet.

If anyone know I would love to learn"
qhetd1,hioikit,Dependent-Report-434,2021-10-30 19:44:43,2,"Thanks for the response guys, I think I will enroll MIT xPro after doing all the research and asking many pros in this field. Plz message me if you are interested as well and I can refer you, and we both get $500 off.

[https://executive-ed.xpro.mit.edu/professional-certificate-data-engineering](https://executive-ed.xpro.mit.edu/professional-certificate-data-engineering)"
qhetd1,hidr58b,Delicious-View-8688,2021-10-28 14:02:04,1,Data Engineer Nanodegree by Udacity is a thing. Pretty good.
qhetd1,hifnjyj,FunRevolution4898,2021-10-28 21:37:49,1,"I am a senior in EE, currently working as a Data engineer intern at HCL. This internship is quite special since the first half of the internship, they taught/trained me the basic of data engineer and tools that they use in their company. if you can, I recommend trying this internship out. They offer internship quarterly. btw, it's part-time so it's quite doable while attending school.

https://www.hcltech.com/rise-at-hcl/internship-opportunities"
qhetd1,hihb7f2,Davidzre,2021-10-29 05:52:57,1,I'm considering about enrolling with Thinkful's data science program and just learn the other tools on my own. Do you think that's a good idea?
qhetd1,hiohjcn,Dependent-Report-434,2021-10-30 19:37:11,1,"Thank you! I did some research and reached out to some of my friends in tech companies. One of them working as a data scientist in Facebook (Or Meta lol) recommended me MIT xPro. It is pretty cheap for what you get. You get enough hands on experience to build up a solid portfolio, you get to learn a lot of the things you need, it is very enterable for someone who doesn't have a solid foundation in this field. They also have career assist as well. It looks pretty solid. I will forward you the link, and it will be great if we can enroll and study together!!"
qhetd1,hx7fc6q,Sharkweek22,2022-02-16 18:46:26,2,"I'm thinking about enrolling. Did you enroll? If so, what are your thoughts? Thanks!"
qhetd1,hsi7mx7,Odd-Sock9837,2022-01-13 16:44:38,1,"Hi, how is MY xPro doing?  
I have read bad reviews. I've been looking for a long time, and it's the best option, but I've read bad reviews on reddit"
qhetd1,hiedagw,AccordingSurround760,2021-10-28 16:32:06,1,"I’m curious what you liked about it? There was some good stuff here and there but I thought a lot of it was absolutely terrible, like the entirety of the first module. The woman just reads off a PowerPoint which she doesn’t even seem to have rehearsed. Even with the discounts it seems very overpriced."
qhetd1,hik1m4m,543254447,2021-10-29 20:08:03,1,Sorry but I have no idea to be honest. I am not experienced enough to answer that unfortunately.
qhetd1,hip3ztw,543254447,2021-10-30 22:26:11,1,"Hey Dependent!

I am currently also looking into WeCloudData as well since they are geographically close to me.  Will definitely share with you what I found!

I am currently also looking into WeCloudData as well since they are geographically closers to me.  Will definitely share with you what I found!"
qhetd1,hx7h5pa,Dependent-Report-434,2022-02-16 18:57:56,2,"Exactly, since this program just started last October, there's a lot to be improved on. You definitely learn a lot, but you will also spend time to fix all the errors of the files and assignments"
qhetd1,hife4qb,Delicious-View-8688,2021-10-28 20:33:35,1,"True. I've done a few ND with them, and DEND was not their best. But, the content curation is good and makes up for some quality issues. I was able to finish the ND in a month - if that helps with the pricing issue at all...

When it came out, it was the only DE training out there with a verified certificate and a list of small projects that can make it sound like you've touched on the main things you should know as a junior DE. Data Warehouse, Data Lake, Spark, Airflow. I took this DEND with colleagues at work, and it felt like we can talk data engineering with a common set of knowledge. The DEND wasn't about the tools though: them covering OLTP vs OLAP, star schema, etc was great - as many DEs that I came across so far didn't seem to know about them and I found it frustrating.

I should mention, DataCamp also has a Data Engineer track that is much cheaper and covers similar content, but does lack in ""project"" experience. Recommend this one too.

Microsoft and Google both have their cloud specific certification on Data Engineering (AWS one is called Data Analytics Specialty) - but I think these will be great with actual cloud data engineering experience."
qhetd1,hirqh7k,Dependent-Report-434,2021-10-31 14:58:40,1,"> also looking into WeCloudData as well since they are geographically close to me.  Will definitely share wit

I see. Please let me know. Is WeCloudData an in-person bootcamp? MIT one is fully online."
qawla7,hh5psmi,AutoModerator,2021-10-18 21:38:31,1,"Rule for bot users and recruiters: to make this sub readable by humans and therefore beneficial for all parties, only **one post per day per recruiter** is allowed. You have to group all your job offers inside one text post. 

[Here is an example of what is expected, you can use Markdown to make a table.](https://www.reddit.com/r/BigDataJobs/comments/phaolk/19_new_data_science_data_engineering_and_machine/) 

Subs where this policy applies: /r/MachineLearningJobs, /r/RemotePython, /r/BigDataJobs, /r/WebDeveloperJobs/, /r/JavascriptJobs, /r/PythonJobs

Recommended format and tags: [Hiring] [ForHire] [Remote] [Flask] [Django]

Happy Job Hunting.

*I am a bot, and this action was performed automatically. Please [contact the moderators of this subreddit](/message/compose/?to=/r/PythonJobs) if you have any questions or concerns.*"
6egk8n,dias0dd,adamfightthecube,2017-06-01 01:41:55,3,"If you have a solid amount saved in the bank (you can also get student loans for this) you can put down on a coding bootcamp 12 week intensive program for data science...it will help show you the doors. 

Otherwise start making analytics apps in python (very much the language of data science), and slowly start applying to entry level jobs in your city. You will break through."
6egk8n,diau9oy,lengthy_preamble,2017-06-01 02:32:05,1,"That's good to know, thank you. All the stuff that can be done in Spark looks intimidating at first, but it's good to know that it's possible."
6egk8n,dj0m8lj,the_siloviki,2017-06-17 05:01:31,1,"I think employers would rather see impressive personal projects, solid internships, and a solid set of references. A bootcamp doesn't meaningfully provide the necessary knowledge for a successful career in data science."
